{
  "$schema": "http://json-schema.org/draft-07/schema#",
  "$id": "https://bentrd.github.io/GambonanzaMods/registry/modpack-schema.json",
  "title": "Gambonanza modpack registry entry",
  "description": "One file per modpack under registry/modpacks/<id>.json. A modpack is somebody's whole setup: the registry mods they play with, plus the registry texture packs they wear, in precedence order. It has no repository, no release asset and no binary of its own - installing a pack installs each member through the exact same verified path as installing it alone. Members may be unreviewed submissions; the manager shows a warning icon on any pack that contains one, and names them before installing.",
  "type": "object",
  "additionalProperties": false,
  "required": ["id", "name", "author", "summary"],
  "properties": {
    "id": {
      "type": "string",
      "pattern": "^[a-z0-9][a-z0-9-]{1,38}[a-z0-9]$",
      "description": "Unique, permanent, lowercase id. Must match the file name."
    },
    "name": {
      "type": "string",
      "minLength": 2,
      "maxLength": 48,
      "description": "Display name shown in the mod manager."
    },
    "author": {
      "type": "string",
      "minLength": 1,
      "maxLength": 48,
      "description": "Who curated the pack. Usually the GitHub username."
    },
    "summary": {
      "type": "string",
      "minLength": 8,
      "maxLength": 140,
      "description": "One line, shown on the pack card. What is this pack FOR?"
    },
    "description": {
      "type": "string",
      "maxLength": 4000,
      "description": "Optional longer text. Plain text or light markdown."
    },
    "mods": {
      "type": "array",
      "minItems": 0,
      "uniqueItems": true,
      "items": {
        "type": "string",
        "pattern": "^[a-z0-9][a-z0-9-]{1,38}[a-z0-9]$"
      },
      "description": "Registry ids of the member mods, in suggested install order. Dependencies (like gambit-api) are pulled in automatically and do not need to be listed. May be empty when the pack is texture packs and nothing else - but a pack needs at least one of mods or texturepacks."
    },
    "texturepacks": {
      "type": "array",
      "minItems": 0,
      "uniqueItems": true,
      "items": {
        "type": "string",
        "pattern": "^[a-z0-9][a-z0-9-]{1,38}[a-z0-9]$"
      },
      "description": "Registry texture-pack ids the setup wears, HIGHEST PRECEDENCE FIRST. Several can be on at once; where two change the same sprite or string, the earlier one in this list wins. Installing the modpack downloads and applies them all, in this order, alongside the mods."
    },
    "tags": {
      "type": "array",
      "maxItems": 5,
      "items": {
        "type": "string",
        "enum": ["gameplay", "gambits", "strains", "quality-of-life", "ui", "visual", "audio", "cheats", "library", "tools"]
      },
      "description": "Same vocabulary as mod tags."
    },
    "homepage": {
      "type": "string",
      "maxLength": 200,
      "pattern": "^https://",
      "description": "Optional link with more about the pack."
    },
    "submittedBy": {
      "type": "string",
      "maxLength": 48,
      "description": "GitHub login of whoever submitted the pack."
    },
    "addedAt": {
      "type": "string",
      "pattern": "^[0-9]{4}-[0-9]{2}-[0-9]{2}$",
      "description": "Date the pack entered the registry, YYYY-MM-DD."
    }
  }
}
